{
  "settingId": "spuk_im_gewoelbe",
  "hinweis": "Die Figuren des Falls: Detektiv, Opfer und 20 Rollen. Name, Alter, Herkunft, Besetzungsplatz und Tarn-Alibi stammen aus dem Kanon (K2), alles andere aus der Überlagerung.",
  "lookHinweis": "Look: Farben als Hex, Kopfform und Statur aus festen Listen. Die Farbe jeder Rolle unterscheidet sich im selben Raum deutlich von den anderen.",
  "detektiv": {
    "id": "detective",
    "title": "Der Detektiv / Die Detektivin (Geburtstagskind)",
    "selectableGenders": [
      "m",
      "w"
    ],
    "colorCode": "#B8A48A",
    "farbname": "Sandbeige",
    "startRoom": "kamin_gewoelbe",
    "ermittlungsOrt": "geburtstagsplatz",
    "coordinates": {
      "x": 12.5,
      "y": 17.5
    },
    "visualSpecs": {
      "silhouette": "Mittelgroß, aufmerksame Haltung, Kopf leicht schief beim Zuhören",
      "baseOutfit": "Heller sandbeiger Trenchcoat über Alltagskleidung, schwarze Jeans, dunkle Turnschuhe",
      "accessories": [
        "Markante Brille",
        "Braun karierter Detektivhut",
        "Unangezündete Pfeife, aus der Seifenblasen steigen"
      ],
      "interactiveTool": "Handy in der Hand mit Taschenlampen-Lichtkegel",
      "idleAnimation": "Bläst mit der Pfeife ein paar Seifenblasen und tippt aufs Handy"
    },
    "tatnacht": "Ab vier Minuten vor Mitternacht steht das Geburtstagskind an der verkeilten Eichentür und lauscht. Durch die gesplitterte Füllung hört es nach dem Knall ein Klimpern, einen tiefen Ruf, einen dumpfen Schlag, Poltern und rollende Dosen. Danach folgt der Schrei, direkt neben der Tür. Damals hält es alles für die Show.",
    "auftrag": "Fünf vor halb eins bittet der Burgwart das Geburtstagskind: „Du hast heute Geburtstag, du hast den klarsten Kopf. Finde raus, wer’s war.“",
    "nieVerdaechtig": true,
    "look": {
      "haut": "#d9a983",
      "haar": "#4a3222",
      "kopf": "detektivhut",
      "statur": "normal",
      "schnitt": "suit"
    }
  },
  "opfer": {
    "id": "burgwart",
    "name": "Eckehard Lüddecke",
    "age": 71,
    "geschlecht": "m",
    "roleTitle": "Der Burgwart",
    "isNpc": true,
    "colorCode": "#7A6A55",
    "farbname": "Graubraun",
    "startRoom": "kamin_gewoelbe",
    "ermittlungsOrt": "an_der_bank",
    "coordinates": {
      "x": 3.5,
      "y": 17.5
    },
    "status": "Nach dem Schlag kurz bewusstlos. Er kommt nach zweieinhalb Minuten zu sich, hat eine Beule am Hinterkopf und eine Gedächtnislücke für die Sekunden davor. Danach sitzt er mit einem Kühlpack aus Tiefkühlerbsen auf der Bank am Kamin und ist bald wieder grantig.",
    "visualSpecs": {
      "silhouette": "Kräftig, leicht gebeugt, buschige weiße Augenbrauen, kurzer weißer Bart",
      "outfit": "Cordhose, Strickweste mit vielen Taschen, festes Schuhwerk, Gürtel mit Karabiner",
      "distinguishingFeature": "Eine Lesebrille auf der Stirn und ein Kühlpack aus Tiefkühlerbsen auf dem Kopf",
      "idleAnimation": "Brummt vor sich hin und drückt das Kühlpack an die Beule"
    },
    "motiveAndConflict": "Seit 1994 hütet er die Burg. Er duzt alle und grüßt mit „Glück auf!“. Heute ärgert er sich über die zerstörte Eichentür und den verschwundenen Taler, aber er hat Humor.",
    "warmeSeite": "Er redet mit der Rüstung Kunibert wie mit einem alten Kameraden und hat Adnan den Türschaden mit Handschlag verziehen.",
    "erinnerung": "Er saß im Dunkeln hinter dem Regal, hörte die Dose klimpern und packte zu. Er rief „Hab ich dich!“. Danach weiß er nichts mehr, nur noch, dass der Arm in Wolle und Leinen steckte.",
    "schluesselbund": "schluesselbund",
    "gedaechtnisLueckeAb": "23:58:18",
    "look": {
      "haut": "#e0b79a",
      "haar": "#e8e6e0",
      "kopf": "none",
      "statur": "broad",
      "schnitt": "suit"
    },
    "schluesselbundMaterial": "Große Buntbartschlüssel aus dunklem Eisen an einem Karabinerhaken und ein kleiner Vitrinenschlüssel."
  },
  "figuren": [
    {
      "id": "adnan",
      "name": "Adnan",
      "vollerName": "Adnan Hodžić",
      "aussprache": "AD-nan HOD-schitsch",
      "age": 33,
      "geschlecht": "m",
      "herkunft": "bosnisch",
      "tier": 1,
      "besetzungsplatz": 1,
      "minPlayers": 1,
      "roleTitle": "Der Veranstaltungstechniker",
      "isPotentialKiller": true,
      "colorCode": "#1A1A1A",
      "farbname": "Schwarz",
      "startRoom": "kamin_gewoelbe",
      "ermittlungsOrt": "platz_adnan",
      "coordinates": {
        "x": 2.5,
        "y": 16.5
      },
      "visualSpecs": {
        "silhouette": "Schlank, aufrecht, ruhiger und praktischer Blick, kurzer gepflegter Bart",
        "outfit": "Schwarze Arbeitsjacke mit vielen Taschen, graue Strickmütze, feste Arbeitsschuhe",
        "distinguishingFeature": "Ein Multitool am Gürtel und Kabelbinder in der Jackentasche",
        "idleAnimation": "Prüft mit dem Daumen die Kante seines Multitools und nickt zufrieden"
      },
      "motiveAndConflict": "arbeitet seit drei Jahren bei den Burgfesten für die Stiftung; hat den Keller für die Feier besorgt; hat um 17:40 mit dem Punschkessel-Wagen die Eichentür der Speisekammer beschädigt, der Burgwart verlangte daraufhin 3.800 Euro bar bis Mitternacht",
      "blackoutAlibi": "„Ich war die ganze Zeit am Kamin und hab gegen den Qualm gekämpft. Kurz vor dem Schrei stand Merle neben mir. Dann bin ich mit dem Geburtstagskind über den Turm in die Speisekammer.“",
      "roleSecret": "1) Er hat Rojda um 18:30 für ihren Geburtstagsstreich den Code des Sicherungskastens aufgeschrieben und seine Stablampe „HODŽIĆ VT · 3“ geliehen, mit der Warnung, vorher Kessel und Heizstrahler auszuschalten. Er weiß nicht, wer das Gespenst sein sollte. Dass der Knall seine Hauptsicherung zerstört hat, ist ihm peinlich. 2) Der Keller war umsonst, ein Gefallen gegen eine neue Lichtanlage fürs Burgfest. Seit Jonas' Rede „Die Miete ist bezahlt!“ ahnt er, dass Jonas Geld eingesammelt hat, hat ihn aber nicht darauf angesprochen. 3) Um 23:30 hat er den Türschaden per Handschlag erledigt: Er repariert die Tür selbst und baut beim Burgfest zusätzliches Licht.",
      "persoenlichesZiel": "Den Türschaden und den Stromausfall in Ordnung bringen, ohne eine Freundin zu verraten.",
      "nebendelikt": {
        "id": "nd_adnan_code",
        "text": "Hat Rojda für ihren Streich den Code des Sicherungskastens aufgeschrieben und seine Stablampe geliehen."
      },
      "loyalitaet": {
        "zu": "rojda",
        "grund": "Er hat ihr für den Streich Code und Lampe gegeben und will sie nicht verraten."
      },
      "luegen": [
        {
          "id": "luege_adnan_code",
          "behauptung": "Den Code kenn nur ich und der Alte.",
          "wahrheit": "Er hat Rojda den Code für ihren Streich aufgeschrieben.",
          "duWahrheit": "Du hast Rojda den Code für ihren Streich aufgeschrieben."
        }
      ],
      "innocentProfile": {
        "actualBehavior": "Kniet ab zwölf vor zwölf am Kamin, reißt um acht vor zwölf Turmtür und Läden auf und bleibt bis zum Schrei bei der Glut. Der Ruß an seinen Händen stammt vom Kamin."
      },
      "look": {
        "haut": "#d6a982",
        "haar": "#3b2a20",
        "kopf": "cap",
        "statur": "normal",
        "schnitt": "suit"
      },
      "alltag": "Ist selbstständiger Veranstaltungstechniker und fährt mit seinem Transporter zu jedem Fest."
    },
    {
      "id": "rojda",
      "name": "Rojda",
      "vollerName": "Rojda Baran",
      "aussprache": "ROSCH-da BA-ran (das J wie in „Journal“)",
      "age": 29,
      "geschlecht": "w",
      "herkunft": "kurdisch",
      "tier": 1,
      "besetzungsplatz": 2,
      "minPlayers": 2,
      "roleTitle": "Die Geräuschemacherin",
      "isPotentialKiller": true,
      "colorCode": "#5A5F66",
      "farbname": "Anthrazit",
      "startRoom": "kamin_gewoelbe",
      "ermittlungsOrt": "platz_rojda",
      "coordinates": {
        "x": 4.5,
        "y": 14.5
      },
      "visualSpecs": {
        "silhouette": "Lebhaft, schnell in den Gesten, lange dunkle Locken",
        "outfit": "Schwarzer Hoodie, weiße Turnschuhe mit glatter Sohle, Kopfhörer um den Hals",
        "distinguishingFeature": "Große Kopfhörer, aus denen leise ein Wind pfeift",
        "idleAnimation": "Hält die Hand ans Ohr, lauscht und zeichnet mit dem Finger Klangwellen in die Luft"
      },
      "motiveAndConflict": "hat ihn bei der Führung über die Akustik des Gewölbes ausgefragt; er nennt sie „Radio“",
      "blackoutAlibi": "„Ich war im Gewölbe, und als es kurz vor zwölf dunkel wurde, war ich schon unten im Turm, weil ich das Licht wieder anmachen wollte. Ich kenn mich doch mit Technik aus.“",
      "roleSecret": "Sie ist die Regisseurin des Geburtstagsstreichs. Sie hat den Track „Geisterstunde“ gebaut und Merle vor Wochen als Gespenst gewonnen. Von Adnan hat sie Code und Lampe. Sie hat die Box neben die Eichentür gestellt und das Geburtstagskind zum Lauschen geschickt. Um 23:58:00 hat sie selbst den Hauptschalter umgelegt, ohne Kessel und Heizstrahler auszuschalten. Sie fühlt sich schuld an allem.",
      "persoenlichesZiel": "Ihr Versprechen an das Gespenst halten und gutmachen, was ihr Streich angerichtet hat.",
      "nebendelikt": {
        "id": "nd_rojda_streich",
        "text": "Hat den Geisterstreich geplant, den Track aufgenommen und den Hebel am Sicherungskasten gezogen."
      },
      "loyalitaet": {
        "zu": "merle",
        "grund": "Merle ist ihre Freundin und das Gespenst, das sie für den Streich gewonnen hat."
      },
      "luegen": [
        {
          "id": "luege_rojda_licht",
          "behauptung": "Ich wollte nur das Licht wieder anmachen.",
          "wahrheit": "Sie hat den Hebel für ihren Streich selbst gezogen.",
          "duWahrheit": "Du hast den Hebel für deinen Streich selbst gezogen."
        },
        {
          "id": "luege_rojda_box",
          "behauptung": "Die Box spinnt. Einen Streich gab es nicht.",
          "wahrheit": "Der Schrei kam von ihrem Track Geisterstunde. Sie hat den Streich geplant.",